{
  "schema_version": "1.0",
  "artifact_id": "artifact-example0001",
  "run_id": "run-example0001",
  "kind": "validator-report",
  "uri": "s3://repoeval-artifacts/sha256/11/1111111111111111111111111111111111111111111111111111111111111111",
  "sha256": "1111111111111111111111111111111111111111111111111111111111111111",
  "size_bytes": 2048,
  "media_type": "application/json",
  "producer": {"component": "orientation-validator", "version": "1.0.0"},
  "classification": "internal",
  "retention_class": "development",
  "redaction_state": "complete",
  "scan_state": "clean",
  "created_at": "2026-09-28T18:04:00Z",
  "expires_at": null
}
